{
  "$schema": "http://json-schema.org/draft-07/schema#",
  "$id": "https://home-search.internal/events/DatasetQuarantined/v1",
  "title": "DatasetQuarantined v1",
  "type": "object",
  "additionalProperties": false,
  "required": ["eventId", "eventType", "schemaVersion", "occurredAt", "producer", "aggregateType", "aggregateId", "aggregateVersion", "correlationId", "causationId", "traceId", "payload"],
  "properties": {
    "eventId": {"type": "string", "format": "uuid"},
    "eventType": {"type": "string", "const": "DatasetQuarantined"},
    "schemaVersion": {"type": "integer", "const": 1},
    "occurredAt": {"type": "string", "format": "date-time"},
    "producer": {"type": "string", "const": "ai-service"},
    "aggregateType": {"type": "string", "const": "DatasetVersion"},
    "aggregateId": {"type": "string", "pattern": "[A-Za-z0-9._:-]{1,128}", "maxLength": 128},
    "aggregateVersion": {"type": "integer", "minimum": 1},
    "correlationId": {"type": "string", "maxLength": 128},
    "causationId": {"type": ["string", "null"], "maxLength": 128},
    "traceId": {"type": "string", "pattern": "[A-Za-z0-9._:-]{1,128}", "maxLength": 128},
    "payload": {
      "type": "object",
      "additionalProperties": false,
      "required": ["datasetVersionId", "datasetType", "reasonCode"],
      "properties": {
        "datasetVersionId": {"type": "string", "format": "uuid"},
        "datasetType": {"type": "string", "enum": ["SCHOOL", "CHILDCARE", "ACADEMY", "RAIL", "RETAIL", "LEGAL"]},
        "reasonCode": {"type": "string", "enum": ["CHECKSUM_MISMATCH", "SCHEMA_INVALID", "COVERAGE_INCOMPLETE", "QUALITY_GATE_FAILED"]}
      }
    }
  }
}
